Date,Full Name,Email,Alt Email,Phone Number,City,Notes,Lead Status
13/05/2026 14:20,John Doe,john.doe@example.com,,+91 9876543210,Mumbai,"Client is asking to reschedule demo",Follow up requested
13/05/2026 14:25,Sarah Johnson,sarah.johnson@example.com,,9876543211,Bangalore,"Person was busy, will try again next week",Did not connect
13/05/2026 14:30,Rajesh Patel,rajesh.patel@example.com,rajesh.alt@example.com,9876543212,Delhi,"Not interested in our services",Not interested
13/05/2026 14:35,Priya Singh,priya.singh@example.com,,9876543213 / 9998887770,Pune,"Deal closed, onboarding in progress",Sale done
13/05/2026 14:40,No Contact Person,,,,Chennai,"Walked into office, left no details",
